Pregunta,Respuesta
"¿Qué es el paracetamol?", "El paracetamol es un analgésico y antipirético utilizado para aliviar el dolor leve a moderado y reducir la fiebre."
"¿Cuáles son los efectos secundarios del ibuprofeno?", "Los efectos secundarios del ibuprofeno incluyen malestar estomacal, acidez, náuseas y, en casos graves, úlceras gástricas o sangrado."
"¿Para qué se utiliza el omeprazol?", "El omeprazol se utiliza para tratar problemas estomacales y esofágicos como el reflujo ácido y las úlceras."
"¿Puedo tomar paracetamol y aspirina juntos?", "No es recomendable tomar paracetamol y aspirina juntos sin consultar a un médico, ya que ambos medicamentos pueden tener interacciones."
"¿Cuánto tiempo tarda en hacer efecto el paracetamol?", "El paracetamol tarda generalmente entre 30 minutos y una hora en hacer efecto."
"¿Para qué se usa el amoxicilina?", "La amoxicilina es un antibiótico utilizado para tratar infecciones bacterianas, como infecciones de oído, garganta y tracto urinario."
"¿El ibuprofeno es un antiinflamatorio?", "Sí, el ibuprofeno es un antiinflamatorio no esteroideo (AINE) que reduce el dolor, la inflamación y la fiebre."
"¿Qué dosis de ibuprofeno es segura?", "La dosis recomendada de ibuprofeno para adultos es de 200-400 mg cada 4 a 6 horas, sin exceder los 1200 mg al día sin prescripción médica."
"¿Puedo tomar omeprazol a largo plazo?", "El omeprazol puede tomarse a largo plazo bajo supervisión médica, pero el uso prolongado puede tener efectos secundarios como deficiencia de vitamina B12."
"¿Qué es el diclofenaco?", "El diclofenaco es un medicamento antiinflamatorio utilizado para tratar el dolor y la inflamación en enfermedades como la artritis."
"¿El paracetamol es seguro durante el embarazo?", "El paracetamol se considera generalmente seguro durante el embarazo, pero siempre debe consultarse a un médico antes de tomar cualquier medicamento."
"¿Para qué sirve la metformina?", "La metformina se utiliza para controlar los niveles de azúcar en la sangre en personas con diabetes tipo 2."
"¿El paracetamol es un antiinflamatorio?", "No, el paracetamol es un analgésico y antipirético, pero no tiene propiedades antiinflamatorias."
"¿Qué es la loratadina?", "La loratadina es un antihistamínico que se usa para aliviar los síntomas de alergias como estornudos, secreción nasal y picazón."
"¿Qué medicamentos no se deben mezclar con alcohol?", "Algunos medicamentos que no deben mezclarse con alcohol incluyen los antibióticos, antidepresivos, medicamentos para el dolor y para el insomnio."
"¿Cuánto tiempo debo tomar amoxicilina?", "La duración del tratamiento con amoxicilina depende de la infección, pero comúnmente se prescribe durante 7 a 10 días."
"¿Qué efectos secundarios tiene la metformina?", "Los efectos secundarios más comunes de la metformina incluyen malestar estomacal, diarrea y pérdida de apetito."
"¿Para qué se usa la aspirina?", "La aspirina se usa para aliviar el dolor, reducir la fiebre y la inflamación, y prevenir ataques cardíacos y accidentes cerebrovasculares."
"¿Qué es el lorazepam?", "El lorazepam es un medicamento ansiolítico que se usa para tratar la ansiedad y los trastornos del sueño."
"¿El ibuprofeno puede causar daño renal?", "Sí, el uso prolongado o en dosis altas de ibuprofeno puede causar daño renal en algunas personas."
"¿Qué debo hacer si olvido una dosis de amoxicilina?", "Si olvida una dosis de amoxicilina, tómela tan pronto como lo recuerde, pero si está cerca de la siguiente dosis, omita la dosis olvidada."
"¿Qué es el alprazolam?", "El alprazolam es un medicamento ansiolítico utilizado para tratar trastornos de ansiedad y pánico."
"¿Qué es la aspirina infantil?", "La aspirina infantil se refiere a una dosis baja de aspirina (81 mg), comúnmente utilizada para prevenir coágulos en adultos bajo prescripción médica."
"¿Puedo tomar ibuprofeno en ayunas?", "Es mejor tomar ibuprofeno con alimentos para evitar malestar estomacal."
"¿Para qué se utiliza la penicilina?", "La penicilina es un antibiótico utilizado para tratar infecciones bacterianas como la neumonía, la faringitis y la sífilis."
"¿Qué es la loratadina y para qué se utiliza?","La loratadina es un antihistamínico utilizado para aliviar los síntomas de alergias como estornudos, picazón y secreción nasal."
"¿Cómo se debe tomar el alendronato para la osteoporosis?","El alendronato debe tomarse con un vaso lleno de agua, al menos 30 minutos antes de cualquier comida o bebida, y no debes acostarte durante al menos 30 minutos después de tomarlo."
"¿Qué es la metformina y cómo ayuda en la diabetes?","La metformina es un medicamento utilizado para controlar los niveles de azúcar en la sangre en personas con diabetes tipo 2."
"¿Cuáles son los efectos secundarios del uso prolongado de corticoides?","El uso prolongado de corticoides puede causar osteoporosis, aumento de peso, hipertensión y diabetes."
